{
  "$schema": "https://json-schema.org/draft/2020-12/schema",
  "$id": "https://impresso.github.io/impresso-schemas/json/entities/entities.schema.json",
  "title": "Named Entity JSON Schema",
  "description": "Definition of the output representation of entity processing, before indexing. Named entity mentions are expressed as offline annotations with character offsets relative to content items. The output is a list of JSON documents (JSON Lines), one per content item, containing named entities from the article body and title. The tagset corresponds to impresso-HIPE.",
  "type": "object",
  "$defs": {
    "namedEntityList": {
      "type": "array",
      "description": "A list of entities.",
      "minItems": 0,
      "items": {
        "type": "object",
        "properties": {
          "id": {
            "type": "string",
            "description": "The unique identifier of the named entity mention: [Document ID]:[Text Element]:[Left Offset]:[Right Offset]:[Entity Type]:[NER Model]|[NEL Model]"
          },
          "type": {
            "type": "string",
            "description": "NE type (coarse-grained and fine-grained).",
            "enum": [
              "comp.demonym",
              "comp.function",
              "comp.name",
              "comp.qualifier",
              "comp.title",
              "loc",
              "loc.add.elec",
              "loc.add.phys",
              "loc.adm.nat",
              "loc.adm.reg",
              "loc.adm.sup",
              "loc.adm.town",
              "loc.fac",
              "loc.oro",
              "loc.phys.astro",
              "loc.phys.geo",
              "loc.phys.hydro",
              "loc.unk",
              "org",
              "org.adm",
              "org.ent",
              "org.ent.pressagency",
              "pers",
              "pers.coll",
              "pers.ind",
              "pers.ind.articleauthor",
              "prod",
              "prod.doctr",
              "prod.media",
              "time",
              "time.date.abs",
              "time.hour.abs",
              "org.ent.pressagency.Reuters",
              "org.ent.pressagency.Stefani",
              "org.ent.pressagency.Extel",
              "org.ent.pressagency.Havas",
              "org.ent.pressagency.Xinhua",
              "org.ent.pressagency.Domei",
              "org.ent.pressagency.Belga",
              "org.ent.pressagency.CTK",
              "org.ent.pressagency.ANSA",
              "org.ent.pressagency.DNB",
              "pers.ind.articleauthor",
              "org.ent.pressagency.Wolff",
              "org.ent.pressagency.unk",
              "org.ent.pressagency.UP-UPI",
              "org.ent.pressagency.ATS-SDA",
              "org.ent.pressagency.DPA",
              "org.ent.pressagency.AFP",
              "pers.ind.articleauthor",
              "org.ent.pressagency.Kipa",
              "org.ent.pressagency.ag",
              "org.ent.pressagency.Extel",
              "org.ent.pressagency.ATS-SDA",
              "org.ent.pressagency.Havas",
              "org.ent.pressagency.Reuters",
              "org.ent.pressagency.Xinhua",
              "org.ent.pressagency.AP",
              "org.ent.pressagency.APA",
              "org.ent.pressagency.ANSA",
              "org.ent.pressagency.DDP-DAPD",
              "org.ent.pressagency.TASS",
              "org.ent.pressagency.Europapress",
              "org.ent.pressagency.SPK-SMP",
              "unk"
            ]
          },
          "surface": {
            "type": "string",
            "description": "The surface form of the named entity mention, as it appears in the text."
          },
          "lOffset": {
            "type": "integer",
            "description": "The left character offset of the named entity with respect to the corresponding text element (full text for nes, title for tnes)."
          },
          "rOffset": {
            "type": "integer",
            "description": "The right character offset of the named entity with respect to the corresponding text element (full text for nes, title for tnes)."
          },
          "confidence_ner": {
            "type": "number",
            "description": "Confidence score of the Named Entity Recognition process."
          },
          "confidence_nel": {
            "type": "number",
            "description": "Confidence score of the Named Entity Linking process."
          },
          "wkd_id": {
            "type": "string",
            "description": "Wikidata QID if available."
          },
          "wkpedia_pagename": {
            "type": "string",
            "description": "Wikipedia page name, i.e. the last part of the wikipedia URL (e.g.  United_States)"
          },
          "wkpedia_url": {
            "type": "string",
            "description": "Wikipedia page URL, e.g. https://en.wikipedia.org/wiki/United_States"
          },
          "name": {
            "type": "string",
            "description": "In case of a person mention, the entity component of type 'name', as defined in the Impresso HIPE NE Annotation guidelines (https://zenodo.org/records/3585750)."
          },
          "title": {
            "type": "string",
            "description": "In case of a person mention, the entity component of type 'title', as defined in the Impresso HIPE NE Annotation guidelines (https://zenodo.org/records/3585750). "
          },
          "function": {
            "type": "string",
            "description": "In case of a person mention, the entity component of type 'function', as defined in the Impresso HIPE NE Annotation guidelines (https://zenodo.org/records/3585750). "
          }
        },
        "required": ["id", "type", "surface", "lOffset", "rOffset"]
      }
    }
  },
  "properties": {
    "ci_id": {
      "type": "string",
      "description": "Impresso content item ID."
    },
    "ci_type": {
      "type": "string",
      "description": "Impresso content item type."
    },
    "ts": {
      "type": "string",
      "description": "Timestamp of creation of the JSON file (e.g. '2024-05-26T09:48:01Z')."
    },
    "model_id": {
      "type": "string",
      "description": "An alias for the system or model that produced this output, used for transparency and traceability. It should include distinguishing elements like a base name, version, and language."
    },
    "nes": {
      "$ref": "#/$defs/namedEntityList",
      "description": "Named entity mentions extracted from the article body."
    },
    "tnes": {
      "$ref": "#/$defs/namedEntityList",
      "description": "Named entity mentions extracted from the article title."
    }
  },
  "required": ["ci_id", "ts", "model_id", "nes"]
}
